name,price
Наушники Apple AirPods 3rd Gen MME73RU/A White,123 990 ₸
Наушники Apple Airpods MV7N2RU/A White,69 990 ₸
Наушники Sony MDR-EX15LP Black,4 690 ₸
Гарнитура Sven AP-860 Black,3 490 ₸
Наушники Apple EarPods Lightning White,14 990 ₸
Наушники Sony MDR-EX15AP Black,6 390 ₸
Гарнитура игровая HyperX Cloud Stinger HX-HSCS-BK/EE Black,27 990 ₸
Наушники Sony MDR-ZX110 Black,9 990 ₸
Наушники Apple AirPods Pro MLWK3RU/A White,140 990 ₸
Гарнитура Sven AP-010MV Grey,1 890 ₸
Наушники Sony MDR-EX15LP Blue,4 690 ₸
Наушники Sony MDR-EX15AP White,6 390 ₸
Наушники Sony MDR-ZX110 White,9 990 ₸
Наушники Sony MDR-EX15LP White,4 690 ₸
Наушники Apple EarPods 3.5мм White,14 990 ₸
Наушники Sony MDR-EX15LP Purple,4 690 ₸
Гарнитура игровая A4tech Bloody G500 Black,14 990 ₸
Наушники Sony MDRZX310APBQ Black,12 990 ₸
Наушники Sony MDR-EX15LP Pink,4 690 ₸
Гарнитура игровая HyperX Cloud Stinger Core HX-HSCSC2-BK/WW Black,19 990 ₸
Гарнитура игровая A4tech Bloody G501 Black,23 990 ₸
Наушники Samsung Galaxy Buds 2 SM-R177NZKACIS Black,78 590 ₸
Наушники Redmi Buds 3 Lite Black,11 490 ₸
Наушники QCY T1C Black,4 990 ₸
Наушники Sony MDR-XD150/BC Black,13 490 ₸
Гарнитура Sven AP-525MV Black,4 090 ₸
Гарнитура игровая SteelSeries Arctis 1,29 990 ₸
Наушники Apple AirPods Max Space Gray,379 690 ₸
Наушники A4Tech Bloody TWS M70 Blue,28 990 ₸
Наушники Samsung EO-IC100BBEGRU Black,3 890 ₸
Гарнитура игровая HyperX Cloud II KHX-HSCP-RD Red,51 990 ₸
Наушники Sony MDRZX310APWQ White,12 990 ₸
Наушники Xiaomi Redmi Buds 3 White,17 990 ₸
Гарнитура игровая HyperX Cloud Core DTS/ HX-HSCC-2-BK/WW,38 990 ₸
Гарнитура игровая HyperX Cloud Alpha HX-HSCA-RD/EE Red,51 990 ₸
Наушники Sony WI-C400/BZ Black,29 990 ₸
Наушники JBL Tune 510 BT Black,33 990 ₸
Гарнитура игровая SteelSeries Arctis 5 Black,51 990 ₸
Наушники HUAWEI Freebuds 4 Silver Frost,79 890 ₸
Гарнитура игровая Sven AP-G857MV Black,5 990 ₸
Наушники Xiaomi True Wireless Earphones 2S White,26 190 ₸
Наушники HUAWEI Freebuds Pro Silver Frost,99 890 ₸
Наушники A4Tech Bloody TWS M70 Red,29 990 ₸
Наушники Sony WFXB700B.E Black,39 890 ₸
Наушники JBL Tune 510 BT White,33 990 ₸
Наушники HUAWEI Freebuds 4i T0001 White,44 890 ₸
Гарнитура игровая HyperX Cloud Stinger Core Wireless HHSS1C-KB-WT/G White,36 990 ₸
Гарнитура игровая HyperX Cloud Alpha S HX-HSCAS-BL/WW Black,61 990 ₸
Наушники Sony WHCH510/LZ Blue,30 990 ₸
Наушники HUAWEI Freebuds Pro Carbon Black,99 890 ₸
Солнцезащитные очки с встроенными динамиками Bose Frames Rondo L,153 990 ₸
Гарнитура игровая Sven AP-G858MV Black,8 990 ₸
Гарнитура игровая SteelSeries Arctis 3 Black,39 990 ₸
Гарнитура игровая Sven AP-680MV Black,5 790 ₸
Наушники Xiaomi Mi In-Ear Headphones Basic Black,3 690 ₸
Наушники OPPO Enco Buds White,19 990 ₸
Наушники Philips TAT1215BK/10 Black,17 090 ₸
Наушники Vivo 2e TWS Starry Blue,26 790 ₸
Наушники HUAWEI Freebuds 4 Ceramic White,79 890 ₸
Гарнитура игровая A4tech Bloody G437 Black,13 990 ₸
Наушники Samsung Galaxy Buds 2 SM-R177NLVACIS Lavender,78 790 ₸
Наушники Sony WIC310B.E Black,15 990 ₸
Наушники Sony WI-C400/WZ White,29 990 ₸
Наушники JBL T110 Blue,5 590 ₸
Наушники A4tech Bloody TWS M30 Black,19 990 ₸
Наушники Samsung Galaxy Buds 2 SM-R177NZWACIS White,78 590 ₸
Гарнитура Genius HS-200C Black,3 490 ₸
Наушники Samsung Galaxy Buds 2 SM-R177NZGACIS Olive,78 790 ₸
Игровая гарнитура HyperX Cloud II Pro KHX-HSCP-GM Gun Metal,51 990 ₸
Наушники JBL T110 Red,5 590 ₸
Наушники Samsung EO-IC100BWEGRU White,3 890 ₸
Наушники Xiaomi Mi In-Ear Headphones Basic Grey,3 690 ₸
Наушники Sony WF-XB700LZ Blue,66 990 ₸
Гарнитура игровая A4tech Bloody G530 Black,18 590 ₸
Наушники Sony WIC310N.E Gold,15 990 ₸
Наушники Realme Buds Air Pro RMA210 White,27 890 ₸
Наушники QCY T5 White,10 990 ₸
Гарнитура игровая Red Square ECHO RSQ-30010 Black,10 990 ₸
Наушники A4Tech Bloody TWS M90 Black,29 990 ₸
Наушники JBL Tune 510 BT Blue,33 990 ₸
Наушники-гарнитура Sony WF1000XM3S.E Gold,63 990 ₸
Наушники Beats Tour 2 MKPV2ZM/A Siren Red,45 990 ₸
Гарнитура игровая Red Square Bomber V2 RSQ-30013 Black,10 490 ₸
Наушники Xiaomi Mi TWS Earphones Air 2 Pro Black,44 990 ₸
Наушники JBL T215 TWS Black,24 990 ₸
Наушники Sony WF1000XM4B.E Black,159 990 ₸
Наушники HUAWEI Freebuds Pro Ceramic White,79 990 ₸
Наушники JBL Tune 510 BT Rose,33 990 ₸
Наушники Xiaomi Redmi Buds 3 Pro Gray,32 990 ₸
Наушники Philips TAT2205WT/00 White,24 990 ₸
Наушники A4tech Bloody TWS M30 White,19 990 ₸
Наушники Sony WIC310L.E Blue,15 990 ₸
Наушники JBL Tune 115TWS Black,23 990 ₸
Наушники Sony WIC310W.E White,15 990 ₸
Наушники OPPO TWS Enco Free 2 ETI71 White,44 990 ₸
Наушники JBL T215 TWS White,24 990 ₸
Гарнитура игровая Red Square Exo RSQ-30016 Black,7 990 ₸
Гарнитура игровая HyperX Cloud MIX (HX-HSCAM-GM),81 990 ₸
Наушники Sony WF1000XM4S.E Gray,129 990 ₸
Наушники Bang & Olufsen Beoplay E8 Charcoal Sand,72 990 ₸
Гарнитура Genius HS-04S Violet,4 990 ₸
Наушники LG Free Tone FP5B Black,43 990 ₸
Наушники Bang & Olufsen Beoplay E8 3rd Gen Black,179 990 ₸
Наушники Xiaomi Redmi Buds 3 Lite White,11 490 ₸
Наушники Sony True wireless WF-C500BZ Black,36 790 ₸
Наушники JBL Wave 200TWS Black,38 990 ₸
Наушники Sony WISP510D.E Orange,39 990 ₸
Наушники JBL Live Pro+ TWS Black,59 990 ₸
Наушники JBL Tune 125BT Blue,12 990 ₸
Наушники Sony WISP510W.E White,39 990 ₸
Наушники JBL Wave 200TWS Blue,39 890 ₸
Наушники JBL Tune 115TWS White,23 990 ₸
Наушники Bang & Olufsen Beoplay E8 Sport Black,179 990 ₸
Гарнитура игровая HyperX Cloud Stinger S (HHSS1S-AA-BK/G),32 990 ₸
Наушники JBL Tune 225TWS Black,42 490 ₸
Наушники JBL Wave 300TWS Black,44 990 ₸
Наушники Bang & Olufsen Beoplay E8 3rd Gen Grey Mist,179 990 ₸
Наушники HUAWEI Freebuds Lipstick Red,99 990 ₸
Гарнитура игровая Bloody G521 Black,17 290 ₸
Наушники гарнитура Master Dynamic MW07PB Black,102 990 ₸
Гарнитура игровая Razer Kraken RZ04-02830100-R3M1 Black,32 990 ₸
Наушники Jabra Elite 2 Dark blue,24 990 ₸
Наушники JBL Tune 225TWS Blue,39 990 ₸
Наушники LG Free Tone FP5W White,43 990 ₸
Наушники Bang & Olufsen Beoplay E8 Sport Oxygen Blue,179 990 ₸
Наушники JBL Tune 225TWS Ghost Edition Black,42 990 ₸
Наушники OPPO TWS Enco Free 2 ETI72 Black,54 990 ₸
Наушники JBL Wave 200TWS White,39 990 ₸
Гарнитура игровая A4tech Bloody G528C Black,21 990 ₸
Наушники Apple AirPods Pro 2nd Gen MQD83RU/A,174 990 ₸
Гарнитура игровая JBL Quantum 200 Black,15 990 ₸
Наушники JBL Tune 225TWS White,39 990 ₸
Наушники Jabra Elite 2 Dark Grey,24 990 ₸
Наушники Sony True wireless WF-C500WZ White,36 790 ₸
Наушники JBL Tune 225TWS Ghost Edition Orange,39 990 ₸
Наушники JBL Wave 300TWS White,44 990 ₸
Наушники JBL Tune 225TWS Pink,44 990 ₸
Наушники Jabra Elite 3 Navy,34 990 ₸
Наушники Sony True wireless WF-C500GZ Green,36 790 ₸
Наушники Jabra Elite 3 Dark Grey,34 990 ₸
Наушники Sony True wireless WF-C500DZ Orange,45 990 ₸
Наушники LG Free Tone FP8B Black,49 990 ₸
LG құлаққаптары Free Tone FP8W White,49 990 ₸
Гарнитура игровая Logitech G PRO X Gaming Headset Black (981-000818),74 990 ₸
Наушники JBL Wave 300TWS Blue,44 990 ₸
Наушники JBL Tune 225TWS Gold,39 990 ₸
Гарнитура игровая HyperX Cloud Alpha Wireless 4P5D4AA Black,84 990 ₸
Гарнитура игровая Sven AP-U980MV Black,14 990 ₸
Гарнитура игровая Sven AP-G999MV Black,17 790 ₸
Наушники Realme Buds Air 3 RMA2105 Blue,29 990 ₸
Наушники JBL Live Pro+ TWS White,64 990 ₸
Гарнитура игровая Bloody G200 Black,10 990 ₸
Наушники Samsung Galaxy Buds2 Pro SM-R510NZAACIS Gray,119 590 ₸
Наушники JBL Live Pro+ TWS Beige,64 990 ₸
Наушники JBL Live Pro+ TWS Pink,59 990 ₸
Наушники JBL Wave 300TWS Pink,44 890 ₸
Гарнитура игровая Sven AP-G988MV Black,12 390 ₸
Гарнитура игровая Bloody G570 Black,19 590 ₸
Гарнитура игровая Bloody G350 Black,16 690 ₸
Гарнитура игровая Bloody G600i Black,23 990 ₸
Гарнитура игровая Bloody G575 Black,18 990 ₸
Гарнитура игровая Logitech G335 Wired Gaming Headset White,41 990 ₸
Наушники Realme Buds Q2s RMA2110 White,15 990 ₸
Гарнитура игровая Bloody G580 Black,20 690 ₸
Наушники Realme Buds Air 3 RMA2105 White,29 990 ₸
Наушники Samsung Galaxy Buds2 Pro SM-R510NLVACIS Purple,119 590 ₸
Гарнитура игровая Logitech G335 Wired Gaming Headset Black,41 990 ₸
Наушники 2E RainDrops Light True Black,15 790 ₸
Гарнитура игровая Razer Barracuda X,51 990 ₸
Гарнитура игровая Logitech G432 7.1 Surround Sound Black,35 990 ₸
Наушники Realme Buds Q2s RMA2110 Black,15 990 ₸
Наушник HUAWEI Freebuds Pro2 Silver Frost,99 690 ₸
Наушник HUAWEI Freebuds SE White,24 890 ₸
Наушники Samsung Galaxy Buds2 Pro SM-R510NZWACIS White,119 590 ₸
Наушники 2E RainDrops Light True White,15 790 ₸
Наушники 2E S9 WiSport In Ear Blue,11 690 ₸
Наушники 2E S9 WiSport In Ear Red,11 890 ₸
Наушник HUAWEI Freebuds SE Blue,24 890 ₸
Гарнитура Razer Kraken Green,38 990 ₸
Наушники Razer Hammerhead True X,35 990 ₸
Гарнитура игровая Razer Kraken V3 X Black,35 990 ₸
Наушники 2E RainDrops True Black,23 590 ₸
Наушник HUAWEI Freebuds Pro2 Ceramic White,99 690 ₸
Гарнитура Belkin Rockstar Lightning Black,13 490 ₸
Наушники Razer Hammerhead True Wireless Pro,79 990 ₸
Наушник HUAWEI Freebuds Pro2 Silver Blue,99 690 ₸
Наушники Razer Opus X Quartz Pink,45 990 ₸
Наушники Razer Opus Late 2020,99 990 ₸
Наушники Razer Opus X Green,45 990 ₸
Гарнитура игровая Razer Kaira X for Xbox,26 990 ₸
Наушники Razer Hammerhead True Black (2021),65 990 ₸
Гарнитура игровая Razer Kraken V3 Black,35 990 ₸
Гарнитура игровая Razer Kraken V3 Pro Black,89 990 ₸
Гарнитура игровая Razer Kaira Pro for Xbox - White,82 990 ₸
Гарнитура Razer Kaira X for Playstation,30 990 ₸
Гарнитура игровая Razer Kraken V3 HyperSense Black,46 990 ₸
Гарнитура игровая Razer Kaira for Xbox White,57 990 ₸
Гарнитура игровая беспроводная HyperX 4P5D5AA Cloud Core Wireless DTS Black,49 990 ₸
Наушники Oppo Enco Air2 Blue,19 990 ₸
Наушники Oppo Enco Air2 Pro Grey,39 990 ₸
Наушники Apple AirPods (3rd gen) with Lightning Charging Case MPNY3RU/A,104 990 ₸
Наушники Oppo Enco Air2 Pro White,39 990 ₸
Наушники Oppo Enco Buds2 (EТЕ41) W14,19 790 ₸
Наушники B&O Beoplay HX Black Anthracite,259 990 ₸
Гарнитура Razer Kraken Ultimate,52 990 ₸
Наушники B&O Beoplay HX Timber,259 990 ₸
Наушники B&O Beoplay HX Sand,259 990 ₸
Гарнитура Razer Blackshark V2 Pro,90 990 ₸
Наушники JBL JBLT710BTBLU Blue,42 990 ₸
Наушники JBL JBLT710BTWHT White,42 990 ₸
Наушники JBL JBLT205CGD Gold,7 990 ₸
Наушники JBL JBLT710BTBLK Black,42 990 ₸
Наушники JBL Live 660NC Blue,119 990 ₸
Наушники B&O Beoplay H95 Black,539 990 ₸
Наушники JBL Live 660NC White,119 990 ₸
Наушники JBL Live 660NC Black,119 990 ₸
Наушники B&O Beoplay EX Gold Tone,249 990 ₸
Наушники Realme Buds Air 3 Neo RMA2113 Blue,19 990 ₸
Наушники B&O Beoplay Portal PC PS Navy,259 990 ₸
Наушники B&O Beoplay Portal XBOX Grey Mist - OTG,199 990 ₸
Наушники Realme Buds Air 3 Neo RMA2113 White,19 990 ₸
Наушники Realme Buds T100 RMA2109 white,9 990 ₸
Наушники B&O Beoplay EX Black Anthracite,249 990 ₸
Наушники B&O Beoplay Portal XBOX Navy - OTG,199 990 ₸
Наушники Xiaomi Redmi Buds 4 Pro BHR5897GL White,34 990 ₸
Наушники Xiaomi Redmi Buds 4 / White,23 990 ₸
Наушники JBL JBLT570BTWHTRU White,34 990 ₸
Наушники B&O Beoplay Portal PC PS Grey Mist,259 990 ₸
Наушники Xiaomi Buds 3 BHR5526GL White,45 990 ₸
Наушники B&O Beoplay EX Anthracite Oxygen,249 990 ₸
Гарнитура Steelseries Arctis Nova Pro Black,122 990 ₸
Гарнитура игровая JBL Quantum 400BLK,25 990 ₸
Гарнитура Steelseries Arctis Nova 1 Black,31 990 ₸
Наушники JBL JBLT125BTCOR Coral,19 990 ₸
Наушники B&O Beoplay H95 Gold Tone,539 990 ₸
Гарнитура Steelseries Arctis Nova 1 White,31 990 ₸
Наушники B&O Beoplay EQ Midnight Blue,169 990 ₸
Наушники Xiaomi Redmi Buds 4 Blue,23 990 ₸
Наушники B&O Beoplay Portal PC PS Black Anthracite,259 990 ₸
Наушники JBL JBLT570BTROSRU Pink,34 990 ₸
Наушники B&O Beoplay EQ Black,169 990 ₸
Наушники JBL Free II TWS White,19 990 ₸
Гарнитура игровая проводная HyperX Cloud Stinger 2 Wired 519T1AA,29 990 ₸
Наушники Realme Buds T100 RMA2109 black,9 990 ₸
Наушники B&O Beoplay Portal XBOX Black Anthracite - OTG,199 990 ₸
Наушники Apple AirPods Pro with Wireless Case MWP22 White,119 990 ₸
Наушники Apple AirPods II MRXJ2RU White,94 990 ₸
Наушники Samsung Galaxy Buds Live SM-R180NZKASER Black,78 990 ₸
Наушники HUAWEI Freebuds 4i T0001 Black,44 890 ₸
Наушники Hoco M16 Black,78 990 ₸
Наушники Hoco M16 Gold,5 590 ₸
Наушники Hoco M16 Silver,16 990 ₸
Наушники Samsung Galaxy Buds Live SM-R180NZWASER White,108 990 ₸
Наушники JBL T110 White,7 990 ₸
Наушники JBL Tune 205BT Black,29 890 ₸
Наушники Beats Studio 2 MH7E2ZM/A White,28 990 ₸
Наушники JBL T205 Chrome,28 990 ₸
Наушники HUAWEI FreeBuds 3i Carbon (Black),30 990 ₸
Наушники HUAWEI Freebuds Lite White,23 990 ₸
Наушники Jabra Elite 7 Pro Black,19 990 ₸
